{
  "$schema": "https://json-schema.org/draft/2020-12/schema",
  "$id": "https://github.com/empty-user77/Agentty-Marketplace/schema/entry.schema.json",
  "title": "Agentty marketplace entry",
  "description": "One plugin offered in Agentty's Plugins page. scripts/validate.py checks more than this schema can say.",
  "type": "object",
  "additionalProperties": false,
  "required": ["id", "name", "version", "description", "publisher", "license", "source", "module"],
  "if": { "not": { "required": ["official"], "properties": { "official": { "const": true } } } },
  "then": { "required": ["build"] },
  "properties": {
    "id": { "type": "string", "pattern": "^[a-z0-9][a-z0-9-]{1,38}[a-z0-9]$" },
    "name": { "type": "string", "minLength": 1, "maxLength": 60 },
    "version": { "type": "string", "pattern": "^\\d+\\.\\d+\\.\\d+([-+][0-9A-Za-z.-]+)?$" },
    "description": { "type": "string", "minLength": 1, "maxLength": 300 },
    "publisher": { "type": "string", "minLength": 1, "maxLength": 60 },
    "license": { "type": "string", "minLength": 1, "maxLength": 40 },
    "official": {
      "description": "The marketplace's own plugin: its module is a file in modules/ of this repository, which only maintainers can merge, so it needs no build block and its source may be private.",
      "type": "boolean"
    },
    "source": { "type": "string", "format": "uri", "pattern": "^https://" },
    "homepage": { "type": "string", "format": "uri", "pattern": "^https://" },
    "icon": { "type": "string", "pattern": "^[a-z0-9-]{1,40}$" },
    "keywords": { "type": "array", "maxItems": 10, "items": { "type": "string", "maxLength": 30 } },
    "surface": { "enum": ["sidebar", "pane", "status"] },
    "mode": { "enum": ["push", "overlay", "window", "full", "workspace"] },
    "permissions": {
      "type": "array",
      "uniqueItems": true,
      "items": { "enum": ["net.request", "prompt.inject", "terminal.write", "session.read", "workspace.read", "browser.control", "files"] }
    },
    "agents": {
      "description": "The AI agents the plugin can start through prompt.inject, any one of which it needs installed: the ids Agentty's agent/list gives.",
      "type": "array",
      "minItems": 1,
      "uniqueItems": true,
      "items": { "enum": ["claude", "codex"] }
    },
    "build": {
      "description": "Where the module is built from. CI clones this commit, builds it with the pinned Rust, and refuses the entry unless the bytes hash to module.sha256.",
      "type": "object",
      "additionalProperties": false,
      "required": ["repository", "rev", "path", "toolchain", "artifact"],
      "properties": {
        "repository": { "type": "string", "pattern": "^https://" },
        "rev": { "description": "the full commit, not a tag or a branch", "type": "string", "pattern": "^[0-9a-f]{40}$" },
        "path": { "description": "the plugin's directory in that repository", "type": "string", "pattern": "^(?!/)[A-Za-z0-9._/-]{1,200}$" },
        "toolchain": { "description": "the Rust release the marketplace builds with", "type": "string", "pattern": "^\\d+\\.\\d+\\.\\d+$" },
        "artifact": { "description": "the .wasm the build writes, relative to path", "type": "string", "pattern": "^(?!/)[A-Za-z0-9._/-]{1,200}\\.wasm$" }
      }
    },
    "module": {
      "type": "object",
      "additionalProperties": false,
      "required": ["url", "sha256", "size"],
      "properties": {
        "url": { "type": "string", "pattern": "^https://" },
        "sha256": { "type": "string", "pattern": "^[0-9a-f]{64}$" },
        "size": { "type": "integer", "minimum": 1, "maximum": 8388608 }
      }
    }
  }
}
