{
  "id": "hello-rust",
  "name": "Hello Rust",
  "version": "0.1.0",
  "publisher": "Agentty",
  "description": "Hello world for Agentty's WebAssembly plugins: a Rust program that draws a panel in the sidebar and asks for no permissions.",
  "icon": "sparkles",
  "license": "GPL-3.0-or-later",
  "source": "https://github.com/empty-user77/Agentty-Marketplace/tree/main/src/hello-rust",
  "homepage": "https://agentty.run",
  "keywords": [
    "example",
    "rust",
    "wasm"
  ],
  "surface": "sidebar",
  "mode": "push",
  "permissions": [],
  "module": {
    "url": "https://raw.githubusercontent.com/empty-user77/Agentty-Marketplace/main/modules/hello-rust-0.1.0.wasm",
    "sha256": "768ac7e0207a0d014ea5584993c177bb81616dc487c955a6b463187092d5c6ea",
    "size": 93439
  }
}
