{
  "id": "your-plugin-id",
  "name": "Your Plugin",
  "version": "0.1.0",
  "publisher": "Your Name",
  "description": "One sentence about what it does, and why it needs what it asks for.",
  "icon": "sparkles",
  "license": "MIT",
  "source": "https://github.com/you/your-plugin",
  "homepage": "https://github.com/you/your-plugin",
  "keywords": ["example"],
  "surface": "sidebar",
  "mode": "push",
  "permissions": [],
  "module": {
    "url": "https://github.com/you/your-plugin/releases/download/v0.1.0/your-plugin.wasm",
    "sha256": "0000000000000000000000000000000000000000000000000000000000000000",
    "size": 1
  }
}
